{
  "id": "urn:ngsi-ld:PublicService:HealthService123",
  "type": "PublicService",
  "dateCreated": "2026-01-10T09:00:00Z",
  "dateModified": "2026-01-10T09:00:00Z",
  "source": "https://datos.madrid.es",
  "dataProvider": "Ayuntamiento de Madrid",
  "hasName": "Centro de Salud Comunitario Pacífico",
  "hasDescription": "Community health service providing primary care and nursing support to residents of the Pacífico neighbourhood.",
  "isAvailableInLanguage": [
    "http://lexvo.org/id/iso639-3/spa"
  ],
  "involvesFacility": [
    "urn:ngsi-ld:Facility:CentroDeSaludPacifico"
  ],
  "physicallyAvailableAt": "urn:ngsi-ld:Neighbourhood:Pacifico"
}
